{
  "$schema": "project.schema.json",
  "schema_version": 1,
  "project": {
    "project_id": "coordproof_mechanical_room",
    "name": "CoordProof Mechanical Room",
    "description": "Deterministic openBIM MEP coordination reference project for a mechanical room."
  },
  "units": "millimeters",
  "spatial": {
    "project_ifc_name": "Project_CoordProof_MechanicalRoom",
    "site_ifc_name": "Site_OpenBIM_Testbed",
    "building_ifc_name": "Building_MechanicalLab",
    "storey_ifc_name": "Storey_MechanicalLevel_01",
    "storey_elevation_mm": 0.0,
    "space_type_id": "room_shell_001",
    "space_occurrence_id": "room_shell_001",
    "space_ifc_name": "Space_MechanicalRoom_001",
    "space_long_name": "Mechanical Room Coordination Space",
    "space_dimensions_mm": [
      6000.0,
      4200.0,
      3200.0
    ],
    "semantic_source_tool": "IfcOpenShell"
  },
  "systems": [
    {
      "name": "System_CHWS",
      "long_name": "System CHWS",
      "object_type": "chws",
      "description": "Chilled-water supply distribution"
    },
    {
      "name": "System_CHWR",
      "long_name": "System CHWR",
      "object_type": "chwr",
      "description": "Chilled-water return distribution"
    },
    {
      "name": "System_SupplyAir",
      "long_name": "System SupplyAir",
      "object_type": "supplyair",
      "description": "Supply-air distribution"
    },
    {
      "name": "System_ReturnAir",
      "long_name": "System ReturnAir",
      "object_type": "returnair",
      "description": "Return-air distribution"
    },
    {
      "name": "System_ElectricalRouting",
      "long_name": "System ElectricalRouting",
      "object_type": "electricalrouting",
      "description": "Electrical cable-routing distribution"
    }
  ],
  "asset_types": [
    {
      "type_id": "room_shell_001",
      "catalog_order": 0,
      "group": "bim",
      "display_name": "Mechanical Room Shell",
      "category": "architectural_shell",
      "source_tool": "FreeCAD BIM",
      "ifc_class": "IfcSpace",
      "parameters": {
        "length_mm": 6000,
        "width_mm": 4200,
        "height_mm": 3200
      },
      "exports": {
        "ifc": "bim/mechanical_room.ifc",
        "freecad_review_ifc": "bim/mechanical_room_freecad_review.ifc",
        "freecad": "freecad/mechanical_room.FCStd",
        "freecad_bim": "freecad/mechanical_room_bim.FCStd",
        "step": "exports/step/mechanical_room_assembly.step"
      },
      "notes": "Room volume and enclosing architectural shell."
    },
    {
      "type_id": "slab_concrete_base_001",
      "catalog_order": 1,
      "group": "bim",
      "display_name": "Concrete Slab Base",
      "category": "architectural_shell",
      "source_tool": "FreeCAD BIM",
      "ifc_class": "IfcSlab",
      "parameters": {
        "length_mm": 6000,
        "width_mm": 4200,
        "height_mm": 200
      },
      "exports": {
        "ifc": "bim/mechanical_room.ifc"
      },
      "notes": "Base slab for the mechanical room."
    },
    {
      "type_id": "wall_north_001",
      "catalog_order": 2,
      "group": "bim",
      "display_name": "North Wall",
      "category": "architectural_shell",
      "source_tool": "FreeCAD BIM",
      "ifc_class": "IfcWall",
      "parameters": {
        "length_mm": 6000,
        "height_mm": 3200,
        "thickness_mm": 200
      },
      "exports": {
        "ifc": "bim/mechanical_room.ifc"
      },
      "notes": "North architectural boundary wall."
    },
    {
      "type_id": "wall_south_001",
      "catalog_order": 3,
      "group": "bim",
      "display_name": "South Wall",
      "category": "architectural_shell",
      "source_tool": "FreeCAD BIM",
      "ifc_class": "IfcWall",
      "parameters": {
        "length_mm": 6000,
        "height_mm": 3200,
        "thickness_mm": 200
      },
      "exports": {
        "ifc": "bim/mechanical_room.ifc"
      },
      "notes": "South architectural boundary wall."
    },
    {
      "type_id": "wall_east_001",
      "catalog_order": 4,
      "group": "bim",
      "display_name": "East Wall",
      "category": "architectural_shell",
      "source_tool": "FreeCAD BIM",
      "ifc_class": "IfcWall",
      "parameters": {
        "length_mm": 4200,
        "height_mm": 3200,
        "thickness_mm": 200
      },
      "exports": {
        "ifc": "bim/mechanical_room.ifc"
      },
      "notes": "East architectural boundary wall."
    },
    {
      "type_id": "wall_west_001",
      "catalog_order": 5,
      "group": "bim",
      "display_name": "West Wall",
      "category": "architectural_shell",
      "source_tool": "FreeCAD BIM",
      "ifc_class": "IfcWall",
      "parameters": {
        "length_mm": 4200,
        "height_mm": 3200,
        "thickness_mm": 200
      },
      "exports": {
        "ifc": "bim/mechanical_room.ifc"
      },
      "notes": "West architectural boundary wall."
    },
    {
      "type_id": "door_access_001",
      "catalog_order": 6,
      "group": "bim",
      "display_name": "Access Door",
      "category": "architectural_shell",
      "source_tool": "FreeCAD BIM",
      "ifc_class": "IfcDoor",
      "parameters": {
        "width_mm": 1000,
        "height_mm": 2100
      },
      "exports": {
        "ifc": "bim/mechanical_room.ifc"
      },
      "notes": "Primary access opening in the south wall."
    },
    {
      "type_id": "equipment_ahu_001",
      "catalog_order": 7,
      "group": "bim",
      "display_name": "Air Handling Unit AHU-1",
      "category": "mechanical_equipment",
      "source_tool": "FreeCAD BIM",
      "ifc_class": "IfcUnitaryEquipment",
      "parameters": {
        "length_mm": 1500,
        "width_mm": 850,
        "height_mm": 1100
      },
      "exports": {
        "ifc": "bim/mechanical_room.ifc"
      },
      "notes": "Main packaged air-handling unit with filter, coil, fan, and service-access context in the IFC schedule."
    },
    {
      "type_id": "pipe_supply_001",
      "catalog_order": 8,
      "group": "bim",
      "display_name": "Supply Pipe Run",
      "category": "flow_segment",
      "source_tool": "FreeCAD BIM",
      "ifc_class": "IfcPipeSegment",
      "parameters": {
        "pipe_diameter_mm": 80,
        "length_mm": 3600
      },
      "exports": {
        "ifc": "bim/mechanical_room.ifc"
      },
      "notes": "CHWS supply pipe route coordinated with valves, support, and AHU coil connection."
    },
    {
      "type_id": "pipe_return_001",
      "catalog_order": 9,
      "group": "bim",
      "display_name": "Return Pipe Run",
      "category": "flow_segment",
      "source_tool": "FreeCAD BIM",
      "ifc_class": "IfcPipeSegment",
      "parameters": {
        "pipe_diameter_mm": 80,
        "length_mm": 3600
      },
      "exports": {
        "ifc": "bim/mechanical_room.ifc"
      },
      "notes": "CHWR return pipe route coordinated with valves, support, and AHU coil connection."
    },
    {
      "type_id": "clearance_ahu_service_zone_001",
      "catalog_order": 10,
      "group": "bim",
      "display_name": "AHU Service Clearance Zone",
      "category": "clearance_zone",
      "source_tool": "FreeCAD BIM",
      "ifc_class": "IfcVirtualElement",
      "parameters": {
        "length_mm": 1800,
        "width_mm": 1000,
        "height_mm": 1900
      },
      "exports": {
        "ifc": "bim/mechanical_room.ifc"
      },
      "notes": "Rule-based transparent clearance volume for AHU service access."
    },
    {
      "type_id": "ahu_filter_001",
      "catalog_order": 12,
      "group": "ifc_detail",
      "display_name": "AHU Filter 01",
      "category": "mechanical_equipment",
      "source_tool": "IfcOpenShell",
      "ifc_class": "IfcFilter",
      "parameters": {
        "length_mm": 120,
        "width_mm": 800,
        "height_mm": 760
      },
      "exports": {
        "ifc": "bim/mechanical_room.ifc"
      },
      "notes": "Filter section tracked as an individual IFC product."
    },
    {
      "type_id": "ahu_coil_001",
      "catalog_order": 13,
      "group": "ifc_detail",
      "display_name": "AHU Coil 01",
      "category": "mechanical_equipment",
      "source_tool": "IfcOpenShell",
      "ifc_class": "IfcCoil",
      "parameters": {
        "length_mm": 160,
        "width_mm": 800,
        "height_mm": 760
      },
      "exports": {
        "ifc": "bim/mechanical_room.ifc"
      },
      "notes": "Cooling coil section connected to CHWS/CHWR ports."
    },
    {
      "type_id": "ahu_fan_001",
      "catalog_order": 14,
      "group": "ifc_detail",
      "display_name": "AHU Fan 01",
      "category": "mechanical_equipment",
      "source_tool": "IfcOpenShell",
      "ifc_class": "IfcFan",
      "parameters": {
        "radius_mm": 260,
        "length_mm": 420
      },
      "exports": {
        "ifc": "bim/mechanical_room.ifc"
      },
      "notes": "Fan section connected to the supply-air system."
    },
    {
      "type_id": "pump_chws_duty_001",
      "catalog_order": 15,
      "group": "ifc_detail",
      "display_name": "Pump CHWS Duty 01",
      "category": "mechanical_equipment",
      "source_tool": "IfcOpenShell",
      "ifc_class": "IfcPump",
      "parameters": {
        "radius_mm": 170,
        "length_mm": 460
      },
      "exports": {
        "ifc": "bim/mechanical_room.ifc"
      },
      "notes": "Duty chilled-water pump with connected distribution ports."
    },
    {
      "type_id": "pump_chws_standby_001",
      "catalog_order": 16,
      "group": "ifc_detail",
      "display_name": "Pump CHWS Standby 01",
      "category": "mechanical_equipment",
      "source_tool": "IfcOpenShell",
      "ifc_class": "IfcPump",
      "parameters": {
        "radius_mm": 170,
        "length_mm": 460
      },
      "exports": {
        "ifc": "bim/mechanical_room.ifc"
      },
      "notes": "Standby chilled-water pump tracked in the IFC product schedule."
    },
    {
      "type_id": "pipe_supply_drop_001",
      "catalog_order": 17,
      "group": "ifc_detail",